name,feature,type,color
30nt_M13R,AGC GGA TAA CAA TTT CAC ACA GGA,primer,grey
ACYC Duet Up1,GGA TCT CGA CGC TCT CCC T,primer,grey
BGH Reverse,TAG AAG GCA CAG TCG AGG,primer,grey
C.elegansRNAi F,GTT TTC CCA GTC ACG ACG TT,primer,grey
"CMVF_pCDNA3
 

",CAA CGG GAC TTT CCA AAA TG,primer,grey
Duet Down1,GAT TAT GCG GCC GTG TAC AA,primer,grey
EGFP C F,CAT GGT CCT GCT GGA GTT CGT G,primer,grey
EGFP C R,GTT CAG GGG GAG GTG TG,primer,grey
EGFP Nrev,CGT CGC CGT CCA GCT CGA CCA G,primer,grey
KS,CCT CGA GGT CGA CGG TAT CG,primer,grey
M13R,CAG GAA ACA GCT ATG ACC,primer,grey
M13F,TGT AAA ACG ACG GCC AGT,primer,grey
PBADF,ATG CCA TAG CAT TTT TAT CC,primer,grey
PBADR,GAT TTA ATC TGT ATC AGG,primer,grey
pCMV forward,GAG CTC GTT TAG TGA ACC GTC,primer,grey
pCMV reverse,CAA GGC CAG GAG AGG CAC TG,primer,grey
PDONR201 3PRIME,CAT CAG AGA TTT TGA GAC AC,primer,grey
PDONR201 5PRIME,GCA GTT CCC TAC TCT CGC,primer,grey
PDONR201 Forward,TCG CGT TAA CGC TAG CAT GGA TCT C,primer,grey
PDONR201 Reverse,GTA ACA TCA GAG ATT TTG AGA CAC,primer,grey
pEXPRESS_F,TAT GGC TAG CAT GAC TGG t,primer,grey
PGEX 3',CCG GGA GCT GCA TGT GTC AGA GG,primer,grey
PGEX 5',GGG CTG GCA AGC CAC GTT TGG TG,primer,grey
malEforward,GGT CGT CAG ACT GTC GAT GAA GCC,primer,grey
PME18SF,CTT CTG CTC TAA AAG CTG CG,primer,grey
PME18SR,GCA CCT GCA GCT CGA GCA CA,primer,grey
POLYA,AAA AAA AAA AAA AAA AAA AAA AAA B,primer,grey
POLYT,TTT TTT TTT TTT TTT TTT TTT TTT V,primer,grey
PQE30 forward,CCC GAA AAG TGC CAC CTG,primer,grey
PQE30 reverse,GTT CTG AGG TCA TTA CTG G,primer,grey
pTargeT reverse,TTA CGC CAA GTT ATT TAG GTG ACA,primer,grey
pTrcHis_F,GAG GTA TAT ATA TTA ATG TAT CG,primer,grey
SK,CGG CCG CTC TAG AAC TAG TGG ATC,primer,grey
SP6 promoter,ATT TAG GTG ACA CTA TAG,primer,grey
T3,ATT AAC CCT CAC TAA AG,primer,grey
T7 promoter (F),TAA TAC GAC TCA CTA TAG GG,primer,grey
T7 terminator (R),GCT AGT TAT TGC TCA GCG G,primer,grey
pCEP-Forward,AGA GCT CGT TTA GTG AAC CG,primer,grey
pCEP-Reverse,GTG GTT TGT CCA AAC TCA TC,primer,grey
pEF1a fwd,ATT TGC CCT TTT TGA GTT TGG,primer,grey
